,title,text,location
16,Md Sporting fans clash with cops in Salt Lake Stadium,"KOLKATA: An unseemly battle between police personnel and Mohammedan Sporting fans at the Salt Lake Stadium on Monday afternoon somewhat took the sheen away from East Bengal''s Super Division League title triumph. East Bengal won the match 3-0.

During half-time, scenes of unrest were noticed from the press-box in the section of the stands earmarked for the Mohammedan Sporting fans who came in numbers expecting an upset victory over East Bengal.

Mohammedan coach Mohammed Habib said that the fans were unhappy with their performance and gave vent to their discontent and frustration.

Apparently police invaded the lower tier and resorted to lathi-charge. Trouble brewed in the upper tier as well and an open battle followed between the police and the spectators.

Protesting police excesses, Habib shepherded his boys out of the ground. They returned to the pitch after 25 minutes and play resumed.

Sporting secretary Sultan Ahmed accused the policemen of beating up their supporters ""unprovoked"".

North 24-parganas SP M.H. Harisen Verma is still not sure what sparked off the crowd unrest. ""The Sporting fans suddenly got violent. Missiles were thrown at the players and police personnel guarding them. We had to take action, else the situation could have worsened,"" he said while talking to The Times of India. He also informed that seven policemen were injured in the clash with the supporters.

Meanwhile, DC (headquarters) Sivaji Ghosh said Sporting supporters pelted stones and brickbats on their way from the Parama Island to No. 4 Bridge damaging a matador, a car. They also ransacked a shop on Dilkhusha Street.

However, no arrests were made, he added.

FOLLOW US ON SOCIAL MEDIA Facebook Twitter Instagram",KOLKATA
