,title,text,location
12,CPI gears up for October 30 rally,"PATNA: The good fortunes of the Communist Party of India (CPI) depends on whether its ""Samajik Badlao Rally"" turns out to be a success or a failure. It would indicate whether the party can bounce back to regain its lost glory.

The rally is scheduled to be held here on October 30.

Perhaps this is the reason as to why the party state leadership has taken the rally seriously.

It could be gauged from the fact that the party state council meeting, held at the party state headquarters here at Ajay Bhavan on Thursday, was informed that the party local units conducted more than 1,000 public meetings, prior to Durga Puja across the state, to make the rally a success.

These meetings were addressed by senior party leaders like Rajya Sabha MP Gaya Singh, national secretariat member Atul Kumar Anjan, state party chief Jalaluddin Ansari and former state secretary Suraj Prasad.

The party has also decided to conduct state-level wall writing and poster campaign to make the party''s presence felt. The party leadership expects a massive turn out of the common people at its Samajik Badlao Rally.

FOLLOW US ON SOCIAL MEDIA Facebook Twitter Instagram",PATNA
13,Criminals rule the roost in Mokama,"PATNA: For the last one decade, Mokama area of Patna district has been witnessing a series of violent incidents. The latest kidnapping of three youths from the Moldiyar Tola locality of Mokama town on October 14 by dreaded gangster Nata Singh has once again exposed the complete grip of criminals in the Mokama area.

And in the existing situation, the police have only one role i.e. ""to witness the emergence of one gang after the elimination of another in this area and that too in gang wars"".

""What the police needs to do is establish its supremacy over the criminals of the area,"" remarked additional director general of police Ashish Ranjan Sinha on Thursday. Remarkably, Sinha''s statement came after his visit to Mokama on Wednesday evening.

He disclosed he held discussions with more than 500 local people on the premises of Mokama police station during his six-hour long stay there in the presence of central range DIG Ravindra Kumar while seeking a solution to end the problems.

The kidnapping of three youths is a case in point to understand the situation in Mokama. No police officer is in the position to attribute the incident to any other reason than the ongoing war of attrition between two gangsters â€” Naga Singh and Nata Singh.

""The kidnapped youths must have been perceived to be Naga''s men,"" Sinha guessed. One of the three kidnapped victims, Amaresh Singh, happens to be Naga''s cousin.

Earlier, the police appeared to have heaved a sigh of relief following the recovery of bodies of two notorious criminals â€” Mini Dilip Singh and Sanjay Singh alias Sanju â€” on September 23 last year from the same area.

Police sources said Naga deserted controversial Mokama MLA Surajbhan a few years back and formed his own gang. Sources further maintained Surajbhan had made several unsuccessful bid to bring peace in Mokama area soon after his victory in the assembly election.

To some extent, the area was crime-free. But things changed following an altercation between Surajbhan and Naga over the issue of a tender. Later, Naga reportedly joined hands with another notorious criminal, Pappu Dev of Saharsa, who is considered to be a rival of Surajbhan.

In the recent past, the Mokama police undertook efforts to destroy the strong network of criminals spread in this area. The police also seized a large number of sophisticated weapons from the criminals recently.

But the failure of the police in checking the emergence of criminals has so far badly affected the industrial establishments like Bata India Limited and Bharat Wagon.

Police sources also maintained that Mokama, unlike the past, is no more a regular source of income by way of crime for the criminals. Another factor behind the police failure is attributed to the topography of the area.

FOLLOW US ON SOCIAL MEDIA Facebook Twitter Instagram",PATNA
14,Fund-starved civic body has no development plan,"DARBHANGA: At a time when various state governments are being pilloried for adopting populist measures, the fund-starved civic body here seems to earn ""kudos"" from certain quarters for being soft on holding-tax defaulters as well as encroachers.

Tax collectors from the municipal body say more often than not people refuse tax payments on the ground ""no facilities, no tax"". Although periodic holding-tax collection camps organised by the authorities in various wards evoke response to a certain extent, the money collected does not constitute a substantial amount to facilitate development activities, civic body sources said.

According to informed sources, municipal authorities have been directed to prepare a list of defaulters, who owe an outstanding amount of Rs 10,000 or more as holding-tax. An amount of over Rs five crore is due as holding-tax on the residents as well as government and other offices situated in various wards, the sources further informed.

However, a resident of ward number 9, a teacher by profession, charged that discrepancies in assessment and fixation of holding-tax is also one of the factors behind dilly-dallying attitude of some of the residents in payment of taxes.

Sporadic anti-encroachment drives launched by the civic body have also failed to provide any concrete solution to the problem as a couple of days after each drive, illegal structures appear once again with a vengeance.

Meanwhile, Darbhanga mayor Omprakash Khedia â€˜Mithhu'' told this correspondent that he does not have any future plans for developmental activities in the face of fund crunch.

""Since assuming charge of the office last month we made hectic efforts to launch a cleanliness drive on priority basis along the main roads as well as Durga Puja venues besides providing street lights in prominent localities. As we did not have fund to carry out the works, the money was arranged through bank loan,"" the mayor informed.

""As of now, our main task is to maintain cleanliness on the occasion of sabe barat festival. Efforts will be made to clean various ghats for chhath festival, which is round the corner,"" the mayor said. As far as development schemes are concerned, we are keeping our fingers crossed, he further said.

FOLLOW US ON SOCIAL MEDIA Facebook Twitter Instagram",DARBHANGA
15,"Vigilance dept arrests JSEB SDO, engineer","JAMSHEDPUR: The anti-corruption cell of the state vigilance department arrested an SDO and an assistant engineer of the Jharkhand State Electricity Board (JSEB) here on Friday.

The vigilance sleuths are reported to have recovered a little over Rs 6.65 lakhs from the residence of the SDO of JSEB''s Mango division, K K Sinha. It''s the largest recovery by the vigilance department since the creation of Jharkhand state.

Sinha along with assistant engineer Gauri Shankar Pundit was caught red-handed accepting Rs 25,000 as bribe from a local industrialist. Both the officers were picked up from Sinha''s old Purulia road residence in Mango this morning.

A team led by DSP Nagendra Choudhary had laid a trap to apprehend the JSEB officials, following a complaint that the duo had demanded a hefty sum to install a new transformer.

The industrialist reportedly had already paid about Rs 88,000 to the JSEB engineers. ""He had approached the vigilance department after a fresh demand of Rs 25,000 more was made,"" sources revealed.

The vigilance officials also searched Pundit''s house in Sidgora. However, nothing incriminating was found at this residence.

The two engineers have been taken to Ranchi and a case has been registered against them. Early this month, the assistant mining officer of East Singhbhum district was nabbed while accepting bribe. The assistant mining officer, Arun Kumar, had allegedly demanded money to clear a project.

The anti-corruption cell of the vigilance department so far has made arrested 101. At least 10 government officials have been nabbed on corruption charges in Singhbhum alone.

FOLLOW US ON SOCIAL MEDIA Facebook Twitter Instagram",JAMSHEDPUR
16,Canal eviction put off under party pressure,"KOLKATA: Bowing to pressure from the city unit of the Left Front, the West Bengal government on Friday deferred its decision to evict settlers along the banks of the Beliaghata canal. The eviction was to have begun from October 22.

""Since the festive season is on, we have decided to defer the eviction campaign,"" state irrigation minister Amalendralal Roy told newspersons at the state secretariat. The Left Front had called upon the government to defer the eviction as the Muslim holy month of Ramzan is to set in soon, ending in the first week of December.

Meanwhile, the Beliaghata Khalpar Basinda Committee, a forum of the encroachers along the canal, have written to the West Bengal Human Rights Commission to intervene in the matter. ""The practice of forced eviction is a gross violation of human rights,"" forum secretary Sona Das said.

The decision about the eviction from Ghazanavi bridge near Cossipore to Beliaghata, was taken late last year. Urban development minister Asok Bhattacharya had then said discussions would be held with citizensâ€™ fora and local political bodies before the evacuation process begins.

The process was to culminate with the eviction on Tuesday. The deadline for the projectâ€™s completion is May 2003.

Roy did not specify when work would restart. ""Around 17,000 people live in these canal banks. They belong to all faiths and we have to honour them,"" he said.

A sum of Rs 2,500 is to be paid to the evictees as shifting allowance. Bhattacharya admitted that the conditions of the Asian Development Bank, which sets rehabilitation of evictees as a mandatory condition for its loan, is causing problems. ""This has set a precedence for encroachers,"" he said.

Roy said that he was opposed to any rehabilitation package. ""These waterways belong to us. Why should we pay to remove those who are illegally occupying it?"" he said. He criticised a section of his own partymen who were sympathising with the encroachers.

The Rs 200-crore loan to the state government by the Housing and Urban Development Corporation to dredge some of the major city canals does not contain any component for rehabilitation. State government sources said the dredging cost has escalated to over Rs 250 crore due to delay in the eviction process.

Mayor Subrata Mukherjee was visibly upset when he heard of the governmentâ€™s decision. ""This is a complete betrayal of the people of Kolkata. Just for the sake of a few, they are playing with the lives of millions of residents of the city,"" he said.

""I have said repeatedly that the cleanup process should be â€˜Now or Neverâ€™. If the eviction proc-ess is not taken up immediately, no one should blame us if streets remain waterlogged or people die due to malaria,"" he added.

FOLLOW US ON SOCIAL MEDIA Facebook Twitter Instagram",KOLKATA
17,Bureaucrats clash over perks,"KOLKATA: The much-hyped austerity drive of the state government has led to a virtual stand-off between the IAS top brass and the middle-tier officers belonging to the West Bengal Civil Services.

The WBCS (Executive) Officers Association, while supporting the government circular on curbing wasteful expenditure, has shot off a letter to the chief minister on Thursday complaining that the drive was biased against them and the lower-level employees.

""We have reasons to believe that the circular was issued by those enjoying perks and privileges brazenly disregarding rules and drawing allowances not enjoyed by the state civil services officers despite performing the same job at a different level. It deliberately hurts the middle tier of the administration,"" the letter stated.

For instance, the new directives regarding cars, phones, etc. have allowed departmental secretaries and special secretaries, mostly IAS officers, to use separate cars.

But joint secretaries, mostly WBCS officers, have been asked to use the pool car, three per ve-hicle while subordinates including deputy secretaries have been denied the privilege. Restriction on phones has also hurt WBCS cadres the most, fumed the association.

""The new measures, instead of addressing serious issues, seeks to wipe out the administration''s middle tier that constitutes the pivot of our system,"" added the letter.

The association sought an ""adequate infrastructural back-up to strengthen the tier"" to ensure a smooth implementation of the development projects.

It demanded a committee of ministers to make periodical review of the drive fearing ""arm-twisting"" by their IAS superiors.

FOLLOW US ON SOCIAL MEDIA Facebook Twitter Instagram",KOLKATA
18,Non-Cong govts have stalled development: Sonia,"GORAKHPUR: All India Congress Committee (AICC) president Sonia Gandhi, blaming the successive non-Congress governments for backwardness prevailing in the state, said that only the Congress could lead the state on the path of development.

Addressing party workers of Gorakhpur and Basti divisions at SNM Tripathi auditorium of the DDU Gorakhpur University here on Friday, she said that the non-Congress governments had stalled all the developmental activities in the state.

Closure of industrial units and sugar mills had created unemployment problem and skilled and non-skilled workers were leading a miserable life, she said adding that anti-social elements were being protected by the ruling combine.

Sonia said that to strengthen the party network in UP she had decided to meet grass-root workers. She said that she had met party workers in Mathura recently and added that more such meetings would be organised in different parts of the state soon.

Exhorting party workers to solve problems being faced by farmers, Sonia said if they too ignored this section of the society then who else would come to their rescue. She admitted that groupism had weakened the Congress in the state and laid stress on discipline.

Urging workers to strengthen the party network in the state, the AICC chief said said that today the people were looking towards the Congress as it was the only party which could solve their problems.

Earlier, when Sonia entered the meeting venue Congress workers rented the air with slogans of Rajiv Gandhi Amar Rahein, Sonia Gandhi Zindabad, Congress party Zindabad. They gave her a standing ovation when she admitted that some undeserving candidates had acquired party posts in the state.

Earlier, state president of the Congress Arun Singh Munna and national treasure Motilal Vora accorded a warm welcome to Sonia. National general secretary of the party Subodhkant Sahai, Mohsina Kidwai, former UP chief minister Ram Naresh Yadav and AICC member and former governor of Haryana Mahabir Prasad were also present on the occasion.

FOLLOW US ON SOCIAL MEDIA Facebook Twitter Instagram",GORAKHPUR
19,"It's a battle of principles, says PDP","SRINAGAR: The PDP on Saturday showed no signs of backing off from its claim to the chief minister''s post in Jammu and Kashmir even as the Congress deputed Manmohan Singh to mediate between the two warring parties.

Stepping up the pressure on the Congress, PDP Vice-President Mehbooba Mufti said, ""Congress should understand that the alliance can get going once someone from the PDP is appointed as the chief minister.""

She said her party was in favour of settling the issues through dialogue but was unaware what the Congress would do next to solve the impasse.

Mehbooba said this was not a fight between PDP President Mufti Mohammed Sayeed and Congress chief Ghulam Nabi Azad, but a battle based on principles.

""Let me make it clear that Congress should understand that PDP has been given the mandate in the Valley against National Conference and should be allowed to serve the people,"" she said.

She alleged that the Congress was spreading rumours about its staking claim to form government which leaves the independents, whose support is crucial for government formation, vulnerable to horse trading.

The PDP vice-president said, ""Congress should come and hold talks and stop making claims and adopting a one-sided approach in resolving the crisis.""

The Congress, on its part, decided to send senior leader Manmohan Singh to Srinagar on Sunday to hold talks with PDP President Mufti Mohammed Sayeed on firming up a coalition government in the state.

A decision to this effect was taken by Congress President Sonia Gandhi in Delhi after consultations with senior party leaders including J&K PCC President Ghulam Nabi Azad, party General Secretary Ambika Soni told reporters here.

The decision of the Congress high command came a day after Sayeed hardened his stand on the issue of chief ministership asserting that the PDP would firm up an alliance with other political parties only at its own terms or might sit in the Opposition.

Soni said the party President decided to send Singh for continuing the process of consultations on the issue of formation of a coalition Government.

""Our main objective is to consolidate the mandate of the people. It should not be frittered away"", she said.

Besides holding talks with the PDP president, Singh would also be interacting with leaders of all other non-National Conference and non-BJP parties including independents, she said.

FOLLOW US ON SOCIAL MEDIA Facebook Twitter Instagram",SRINAGAR
20,Ex-Akali minister Garcha arrested in corruption case,"CHANDIGARH: There seems to be no let up in the Vigilance Bureau''s campaign to trap former SAD ministers in corruption cases.

A team of VB sleuths, in an early morning swoop on Saturday, arrested former technical education minister Jagdish Singh Garcha in Ludhiana on the charge of causing financial loss of about Rs 11.51 crore to the Punjab Technical University, Jalandhar, by committing largescale irregularities in setting up computer and technical education centres in and outside Punjab.

PTU director (outreach) Amarjit Singh Grewal was also picked up by the VB for his alleged connivance with the former SAD minister in the case.

Garcha is the fourth former SAD minister to be arrested by the VB. Earlier, Sucha Singh Langah, Tota Singh and AS Kohar were taken into custody for allegedly indulging in corrupt practices during their tenure as ministers in the SAD-BJP government.

VB chief director AP Pandey said two other associates of Garcha, his son, Parminder Singh and former PTU vice-chancellor, HS Guram, also booked in the case, were at large.

While Garcha''s son was not at his residence when the VB team raided his house, Guram has reportedly gone underground.

Garcha''s son used to indirectly look after the sanctioning of PTU study centres and make collections from those who had been allotted PTU franchisees.

The VB team recovered fixed deposits worth Rs 90.50 lakh, cash worth Rs 3.51 lakh and a computer from the former minister''s office, Garcha Enterprises, besides other documents related to his property, credit cards, and three cellular telephones.

Pandey said the VB investigations have also proved that illegal appointments were made in the PTU while question papers were leaked and answer-sheets tampered with.

Repression, says Badal: Within hours of Jagdish Singh Garcha''s arrest by the vigilance bureau (VB) Shiromani Akali Dal president Parkash Singh Badal strongly condemned the continuing reign of repression and lawless vendetta unleashed by chief minister Amarinder Singh against the SAD leaders.

Badal said that even the whereabouts of Garcha were being kept secret from his family and the party and we have no clue as to what the VB was really upto.

FOLLOW US ON SOCIAL MEDIA Facebook Twitter Instagram",CHANDIGARH
21,Nalco will incur losses if not privatised: Shourie,"NEW DELHI: Amid the ongoing controversies over sale of government equity in PSUs, Disinvestment Minister Arun Shourie on Saturday warned that NALCO would start incurring losses if its privatisation was delayed due to present conditions.

""Nalco will be in the same position as the Steel Authority of India (SAIL) in five years if the same conditions persist"", Shourie told reporters after inaugurating a hostel for North East students here.

Reacting to Coal and Mines Minister Uma Bharti''s reported statement that anyone who trivialises her struggle over Nalco disinvestment would bite the dust, he said Prime Minister Atal Bihari Vajpayee had on Friday clarified the government''s position on the issue to Orissa Chief Minister Naveen Patnaik and wondered whether it meant ""the Prime Minister would bite dust"".

FOLLOW US ON SOCIAL MEDIA Facebook Twitter Instagram",NEW DELHI
22,Musharraf wants favourable govt in Gujarat: Modi,"SAMALJI, Gujarat: Gujarat Chief Minister Narendra Modi on Saturday said that Pakistani President Pervez Musharraf wanted a ''favourable'' government in Gujarat and was, therefore, bent upon creating obstacles to peaceful polls and BJP''s return to power.

""Musharraf wants a favourable government in Gujarat,"" Modi said minutes before flagging off the sixth leg of the Gaurav Yatra from this tribal hamlet in Sabarkanta district.

FOLLOW US ON SOCIAL MEDIA Facebook Twitter Instagram","SAMALJI, Gujarat"
23,Allies threat will not affect NDA govt: Naidu,"MUMBAI: In a veiled attack on Shiv Sena, BJP president Venkaiah Naidu on Saturday night asserted that the NDA government''s stability would not be affected by threats from allies to pull out from the ruling coalition.

""If any ally walks out of the ruling coalition two more will join it,"" Naidu said at a function organised by party''s commerce cell.

Naidu''s statement assumes significance in the wake of Thackeray''s statement that if the NDA failed to heed to his suggestion on disinvestment, labour reforms and tackling terrorism he would ""come into his full colours"".

However, Naidu did not mention Sena or Thackeray in his speech.

Naidu lauded Prime Minister Atal Bihari Vajpayee as the tallest leader in the country saying, no one could come close to Vajpayee in credibility and acknowledgement for leadership qualities.

NDA was firmly in the saddle and there was no threat to its stability of the government, Naidu emphasised.

FOLLOW US ON SOCIAL MEDIA Facebook Twitter Instagram",MUMBAI
24,BJP activist hurt in prison clash,"THIRUVANANTHAPURAM: BJP activist Kaka Shaji suffered severe injuries in a clash between CPM and BJP-RSS detainees at the Kannur central jail on Saturday.

He has been shifted to the Kozhikode medical college. Three wardens and a CPM inmate suffered bruises.

Shaji and two other BJP activists, Unnikrishnan and Anil Kumar, were housed in the second block of the prison.

Following the clash, around 100 CPM prisoners housed in the first block have been shifted to the Borstal school, and 39 BJP-RSS activists in the second block have been taken to closed cells in the 10th block.

FOLLOW US ON SOCIAL MEDIA Facebook Twitter Instagram",THIRUVANANTHAPURAM
25,Udupi math seer challenged to contest polls,"BANGALORE: Incensed by Udupi Adamar math seer Vibudesha Theertha''s statement that he would quit India if Congress president Sonia Gandhi becomes the Prime Minister, two party functionaries have challenged him to abdicate his present responsibilities and contest against any of their candidates from Udupi.

""Being an Indian citizen, the pontiff is free to express his opinion. He is also free to contest against Sonia and try to stop her from becoming the PM,"" KPCC general secretary Prakash K. Rathod and secretary A. Kenche Gowda said on Saturday.

Both also suggested that the seer was free to quit the country, if he is so keen. ""There is no compelling need for him to wait till Sonia becomes the PM. Running several educational institutions, the seer should know that Sonia is a citizen of India from many years, elected to Lok Sabha and is its leader of opposition, a post which is equivalent to the rank of Union minister,"" they said.

The seer on Friday had announced that he would quit India if Sonia becomes the PM as he did not wished to be ruled by a person with ""foreign origin.""

FOLLOW US ON SOCIAL MEDIA Facebook Twitter Instagram",BANGALORE
26,Cong demands Togadia's arrest under Pota,"AHMEDABAD: The Gujarat Congress Committee on Saturday burnt the effigy of VHP leader Praveen Togadia and demanded his arrest under Pota for his derogatory remarks against party president Sonia Gandhi.

The mahila and youth wing of the party demonstrated in front of town hall and burnt effigy of the VHP leader, party spokesman Hasmukh Patel, said here.

""Congress has taken strong exception to the uttering of cheap words against party president Sonia Gandhi,"" he added.

Earlier, Congress Party Mahila Wing and Youth Congress workers led by national observer Sushma Yadav, shouted slogans against Togadia and asked to account for the money collected for temple and bricks.

They demanded the arrest of Togadia under Pota immediately.

The party also decided to gherao Togadia later in the evening at his Bapu Nagar residence here, Patel added.

FOLLOW US ON SOCIAL MEDIA Facebook Twitter Instagram",AHMEDABAD
