,title,text,location
27,Venkaiah defends disinvestment policy,"MUMBAI: Strongly defending Vajpayee government''s disinvestment policy, BJP president Venkaiah Naidu on Saturday night favoured government''s withdrawal from public sector entities and focus on providing infrastructure to the people.

""It is not the government''s business to do business and it should gradually withdraw from it to concentrate on infrastructure development,"" Naidu, who is here in connection with the party central office-bearers meeting, told a gathering of professionals at a function organised by BJP''s commerce cell.

""Why should the government run the loss making public sector units when it does not have funds for infrastructure projects?"" he questioned.

Naidu blamed the negativism of the body politic and emphasised the need for a broad consensus among political parties on issues like population control, environment, work culture, proper conduct of Parliament and state legislatures.

Listing the achievements of the NDA government, he said that progress made in telecom, IT, LPG sectors and infrastructure development was remarkable.

Naidu said that the need of the hour was to progress speedily setting aside contentious issues.

The BJP president, who is under attack for ""soft-pedalling"" on the issue of terrorism, said that the government had effectively combated the menace.

""ISI modules are being busted and government is countering the proxy-war waged by the neighbouring nation,"" he added.

""India can attack Pakistan and was not dependent on any other country to tackle the menace of terrorism,"" Naidu said, adding the government was consciously responding to the scourge. ""How can the menace of terrorism, plaguing the nation for last 20 years be stamped out in mere three years?"" he asked.

BJP spokesman Arun Jaitley said that the security forces had achieved superemacy over terrorists. He lashed out at the Nehruvian model of development and strongly favoured economic reforms.

FOLLOW US ON SOCIAL MEDIA Facebook Twitter Instagram",MUMBAI
28,CPM warns of agitation against anti-farmers policies,"BATHINDA: Raising cudgels against the Union and state governments for their antifarmers policies, the Communist Party of India (Marxist) has warned that economic riots may break out in the state in coming days.

The manner in which marginal farmers in Punjab are being pushed into a corner by the government by stripping them off all subsidies, the day is not far when they would be forced to come on roads starting a violent agitation, Balwant Singh, state secretary of CPM said here on Saturday.

While taking to media persons he said said his party would start a statewide agitation on October 22 from the parade ground in Chandigarh to protest the anti-farmer policies of the Union and state governments.

Increasing input costs, decreasing per hectare yield and stagnant or rather falling price of farm produce would force farmers in the state to embark on an agitational path.

Objecting strongly to the scrapping of free power to the farm sector in Punjab, Balwant Singh alleged that while the agriculture sector was being provided 28.85 per cent of total supplied power in the state, big business houses were indulging in theft of 38 per cent of total power supply in the state but state government has turned a blind eye to it.

Under the dictates of WTO and other international agencies, the government is withdrawing more and more subsidies from the farm sector but no action is being taken against big businessmen who had not returned nationalised banks money to the tune of Rs 11 lakh crore that they had taken as loans.

FOLLOW US ON SOCIAL MEDIA Facebook Twitter Instagram",BATHINDA
29,Man held for stealing from govt warehouse,"NEW DELHI: Delhi Police has arrested a transporter accused of siphoning 11,000 bags of sugar worth Rs 1.5 crore from a government warehouse in Karampura.

A special cell team under assistant commissioner of police L N Rao apprehended Ashok Kumar Goel near Jaipur Golden hospital on Friday evening.

Goel has been handed over to the crime branch. The police are still on a look-out for co-accused and manager of the warehouse S S Rana.

On questioning Goel, the police learnt he used to transport sugar from Uttar Pradesh to the warehouse in Delhi. He had the exclusive contract since 1995.

""This is the first case which has come to light. The scam could be worth more than Rs 1.5 crore,"" a police officer said.

According to the complaint filed by manager (vigilance) B S Mann of Delhi Consumer Co-operative Wholesale Stores Limited, a check was conducted at the warehouse on July 10.

During checking, 11,000 bags of sugar were found missing. When the team inquired about it, Rana claimed ignorance.

A case was then filed against Rana and Goel with the anti-corruption branch. The two, however, went missing since then.

""Goel admitted that he had a godown at Apsara near the Uttar Pradesh and Delhi border. Instead of taking sugar to the warehouse, Goel took it to his godown and then sold it in black,"" the officer said.

FOLLOW US ON SOCIAL MEDIA Facebook Twitter Instagram",NEW DELHI
30,BJP to rally against power tariffs on Oct 22,"CHANDIGARH: While the SAD political affairs committee continued holding its marathon meeting till late on Saturday nighton deciding how best to counter the offensive launched by the Amarinder Singh government against party leaders, the state BJP announced to organise state-wide demonstrations on October 22 to protest against the governmentâ€™s decision to reimpose power tariff on farmers.

State BJP president B L Rinwa and general secretary Avinash Jaiswal in a joint statement condemned the Congress government for going back on its election promise not to burden farmers with power tariff.

""It was a complete betrayal with the farming community,"" they said.

When farmers are reeling under severe drought conditions and acute financial burden, it was criminal to impose more burden on them and compound their problems, they said.

The decision would hit all sections of society and cause resentment against the government, something that threatened to create law and order problems as well.

This has also proved that the Amarinder government had little sympathy for farmers. Be it the cause of providing drought relief or MSP, the state government had exhibited laid back attitude to deal with farmersâ€™ problems, they added.

Meanwhile, the SAD political affairs committee meeting which started at 4 pm at former chief minister Parkash Singh Badalâ€™s residence remained inconclusive till late night about the action plan it proposed to launch.

According to a party spokesman, the final decision would be taken on Sunday after another round of deliberations. The party leaders also expressed concern at the manner in which SGPC members were being hounded by the government.

Badal has called a meeting of all party MPs, MLAs, former MPs, former MLAs and district SAD chiefs in Ludhiana on October 21 to hold more discussion with the party leaders on countering Amarinderâ€™s offensive.

FOLLOW US ON SOCIAL MEDIA Facebook Twitter Instagram",CHANDIGARH
31,Punters see big business if Badal is arrested,"BATHINDA: More than political observers and mediapersons, it is punters who are more interested in the warof-attrition between Punjab chief minister Amarinder Singh and former chief minister Parkash Singh Badal.

The tussle between Sarb Hind Shiromani Akali Dal president Gurcharan Singh Tohra and Badal also has possibilities, say punters.

Punters have now started inviting stakes on the probability of Badalâ€™s arrest and who gets a hold on the executive body of the Shiromani Gurdwara Parbhandak Committee (SGPC).

Will Badal be arrested? Will Tohra elbow Badal out of the SGPC? - are the questions which are netting in money for punters. The key to being a successful punter lies in finding out what people are willing to bet their money on.

""Business should always be booming,"" a punter told Times News Network.

""Whatever hits the front page of newspapers is what punters can exploit to their advantage,"" he added.

As of now their bread and butter depends on whether or not Badal would be arrested. The SGPC polls are also generating a lot of interest among those who are willing to put their money at stake.

Persons who have betted heavily are literally hanging on each word of SAD, SHSAD and Congress leaders. Bookies with Akali leanings are betting on whether Badal will be arrested or not.

About the excitement generated by the possibility of Badalâ€™s arrest, one punter said, ""Congresâ€™s bark has no bite. But those who are hopeful that Badal will be arrested are happy that former SSP Gurcharan Singh Pherurai, has also been arrested. And this may result in Badal arrest.

FOLLOW US ON SOCIAL MEDIA Facebook Twitter Instagram",BATHINDA
32,Fresh probe into Maisar Khana incident,"BATHINDA: The Punjab State Human Rights Commission has ordered a fresh probe into the incident of alleged torture of Bhartiya Kisan Union members by Bathinda police on July 24, last year, at Maisar Khana village here.

The DIG, in his inquiry, had exonerated police of all charges following which the BKU leaders had moved the PSHRC on October 1 on the plea that the DIG report was false, misleading and contrary to facts.

They requested the commission to order another inquiry into the incident through its own agency.

Now the PSHRC has directed SK Verma, ADGP of the commission, to conduct a probe and submit a report within two months.

The commission had earlier directed DIG of crime branch at Chandigarh to probe the incident after BKU leaders lodged a complaint with the PSHRC.

The BKU leaders had charged the police with mercilessly beating up nearly dozen male and female BKU members who had been sitting on a peaceful dharna on the Bathinda-Mansa road on July 24, 2001.

The BKU members had demanded the arrest of a commission agent on the charge of abetment to suicide of Mithu Singh, a farmer of Sandoha village.

FOLLOW US ON SOCIAL MEDIA Facebook Twitter Instagram",BATHINDA
33,Mumbai's spirit rules hearts of expats,"MUMBAI: Mumbai and Delhi are the among the worst cities in the world for expatriates to live in, says a study by the London-based Economist Intelligence Unit (EIU), the business information arm of the Economist group.

The EIU survey, which covered 130 cities, ranked Delhi and Mumbai 121 and 124 and attributed to them an ""extreme"" hardship rating of 62 and 57 per cent respectively. But do our expats really find Mumbai a hardship posting?

Says Englishwoman Aloise Price, wife of Dominic Price, managing director of JP Morgan, and mother of three: ""I''m astonished. I wonder if anyone actually visited the 130 cities in order to make the comparison. To those having a positive attitude and some imagination, an expatriate life in Mumbai is colourful, exciting, invigorating and a better alternative to many others,"" says Price.

""Recreational options may not be as neat and prepackaged as they are in many cities that scored higher, but with a little imagination there are a multitude of things to do here. Moreover, the friendliness and welcoming attitude of the Mumbaiites must rank right up at the top versus most cities,"" she adds.

Australian consular officer Renee Jarvis, who came in early this year from Melbourne (a steep fall from the No 1 city to No 124), thinks so too.

""I feel at home here because Indians are friendly,"" Jarvis said. ""Of course, Mumbai is not as easy as Melbourne. Housing''s a lot more expensive. One spends a lot more time commuting here, the traffic congestion''s awful. There''s less access to parks and beaches, less time for friends and outdoor activities. But the place is so vibrant that one can live with the pinpricks.""

Agrees Swiss consul Joseph Koch, a son-in-law of the soil.

""The climate''s bad, the pollution''s worse, housing''s costly, cello teachers aren''t easy to come by. And the German School couldn''t take my 13-year-old twins in because they would have been the only ones in the sixth grade. So the kids had to join the American School and switch to studying in English, which isn''t easy even if their mother is an Indian,"" laments Koch.

""But one factor makes up for all these irritants â€” the spirit of Mumbai. This city is very alive, very energising... quite unlike Karachi, where we went to party after party but had absolutely no cultural life.""

And what about this ""hardship allowance"" â€” as the EIU recommended â€” for places like Mumbai, Delhi and Karachi? Ridiculous, felt many expats.

""I find little hardship here,"" declared British businessman and Yacht Club regular Graham Tullet, an ex-soldier who spends half his time in Mumbai. ""In fact, some services are far better in India than they are in England, like health, for instance. The National Health Service in England has gone down the tube. So when I need treatment of any sort, I get it done in India.""

""That''s right,"" chipped in Aloise Price. ""Some of my fellowmen have abandoned their National Health Service waiting lists in the UK, to have their ills attended to quickly, efficiently and at negligible cost here.""

FOLLOW US ON SOCIAL MEDIA Facebook Twitter Instagram",MUMBAI
34,Over 193 engg seats remain vacant in govt colleges,"AHMEDABAD: Students of Gujarat have stuck a rude thumbs-down to the ever-increasing number of payment seats granted to self-financed colleges by the state government.

An unprecedented, 193 engineering payment degree seats still lie vacant as the centralised admission process draws to a close on Saturday. Whatâ€™s more, an estimated 1,200 diploma engineering seats are also going to be vacant this year!

In the past three years, an estimated 4,000 degree as well as diploma seats were increased at engineering colleges across the state. But the state government seems to have got its demand and supply equation all wrong this time. Never in the past have students given a go by to such a large number of engineering seats.

â€œThis is for the first time that such a large number of engineering degree seats have remained vacant. In the past, the highest number of seats to go unfilled was not more than 50,â€� said Prof H N Prajapati, who heads the centralised admission committee for engineering and pharmacy degree and diploma courses.

Of the engineering courses that have been cold-shouldered by the students, the hardest-hit is the Information Technology (IT) stream, where 112 seats are still unoccupied. The significant hike in the number of IT seats during the IT boom is apparently finding no takers ever since the IT bubble burst.

Interestingly, IT is followed by more conventional streams like chemical engineering, where 47 seats are vacant. Other engineering faculties cold-shouldered by the students include food processing with 18 vacant seats, instrumentation and control with three vacant seats, textile technology with six and textile processing with seven vacant seats respectively.

Experts in the engineering fraternity point that a multitude of factors are responsible for this sudden loss of interest in students. First and foremost is the excruciating delay in the centralised admission process that forces many students, especially those with average marks between 60-65 per cent, to seek admission in self-financed colleges outside the state.

â€œA student with 60 per cent marks is insecure about his admission in the state and would obviously not wait till December to find out whether he gets a seat in Gujarat or not. He will obviously go looking for seats in colleges outside the state,â€� said a senior official in the engineering faculty.

Overall recession, experts say, is also contributing to students remaining away from spending huge amounts for taking admission in faculties where there is no assured scope of employment afterwards. â€œOverall scene of unemployment in the engineering industry is also prompting students to refrain from spending lakhs of rupees and taking admission,â€� said another expert.

This is especially applicable to the IT sector where recession has made a big dent. â€œThe state government in its enthusiasm went overboard in increasing IT seats but has done precious little to nurture the IT industry in the state. With such a dismal scenario prevailing in the state, which student will want to invest lakhs of rupees and take admission on a payment seat?â€� quizzed another expert.

FOLLOW US ON SOCIAL MEDIA Facebook Twitter Instagram",AHMEDABAD
35,Govt rules out talks with Pak for now,"NEW DELHI: Despite pressure from the US to start a peace process with Pakistan, the Vajpayee government has rejected the possibility of a dialogue with Islamabad.

The government is prepared to make some goodwill gestures like removing troops from the Western border and more later, but insists there is no possiblility of talks till Pakistan reciprocates with concrete measures denouncing militancy in Kashmir, sources in the home ministry said.

Even while pulling back troops from the border, the government is keeping the forces in a state of preparedness to counter any eventuality.

A meeting to discuss the details of the state of defence preparedness has been called at the South Block (ministry of defence) on October 23. Apart from the commanders of the Army, the Navy and the Air Force and the defence minister, the Prime Minister, the Deputy Prime Minister and the foreign minister will attend the meet.

According to defence ministry sources, the troops will be pulled back from the international border (IB) and not the line of control (LoC). Also, the 3.5 lakh forces stationed along the IB is being pulled back in a phased manner.

The entire process may take about one-and-a-half months.

FOLLOW US ON SOCIAL MEDIA Facebook Twitter Instagram",NEW DELHI
