,title,text,location
10,'Rear guard' action must for trucks,"PUNE: The ministry of road transport and highways has amended the central motor vehicle regulations, making it mandatory for heavy vehicles manufactured on or after May 1, 2003, to be fitted with an ""under-run protective device"" at the rear. The device — in the form on an iron grill or guard fitted 550 mm above the road level — would ensure that in the event of an accident, smaller vehicles coming from behind do not skid under the truck and get trapped. Such mishaps have proven fatal for two-wheeler riders. A copy of the amendment, carried out on December 27, 2002, was recently forwarded to the International Society for Road Transport and Safety (ISRTS), a Nagpur-based non-governmental organisation, which had pressed for it. Addressing a press conference here on Friday, ISRTS executive member Ajit Mandlekar and treasurer Vishwas Bagaddeo circulated a copy of the amendment. It states that the protective grill should be as per Indian Standards 14682 and 14812. The standards specify that the guards should be fitted on both sides, be made either of continuous flat sheet metal or rails and the lower edge of the side guard not be more than 550 mm above the ground. Mandlekar, however, alleged the state transport commissioner had not even circulated a copy of the amendment to all regional transport offices (RTO) in the state. He demanded that the orders should be effected with retrospective effect. ""If the authorities fail to enforce the amendment we will move court,"" he warned.

FOLLOW US ON SOCIAL MEDIA Facebook Twitter Instagram",PUNE
11,Defaulting co-operative: Rs 125 cr govt funds frozen,"PUNE: The Reserve Bank of India (RBI) has frozen treasury account (stamp and registration fees) number 6102002003 with a balance of Rs 124.88 crore in response to a directive issued by the Debt Recovery Tribunal (DRT), Pune, towards recovery of Rs 81.67 crore from the state government. RBI general manager (banking) R. Muralidharan also assured DRT on Thursday that while the government would not be allowed to make withdrawals, daily remittances from the government account in favour of 'Recovery Officer, DRT, Pune' will be made beginning Thursday (May 29). Banking circles here expressed confidence that notwithstanding state chief secretary Ajit Nimbalkar's statement that the government would ""appeal"" against the DRT order, there would now be little difficulty in recovering the long-pending dues. This development comes amid yet another action taken by DRT, Pune, for recovery of Rs 27.96 crore from the state government and the Jalgaon-based Chopda farmers' cooperative sugar factory. In his judgement of May 26, DRT presiding officer Shrikant Kulkarni issued a ""recovery certificate"" ordering recovery of dues amounting to Rs 34 crore from the Jalgaon-based factory. Delivering his order in response to a recovery suit filed by IDBI, IFCI and ICICI, Kulkarni ordered recovery of Rs 27.96 crore in favour of IDBI and IFCI from the principal borrower (cooperative sugar factory) and the state government, which served as a guarantor to the loan advanced to the sugar factory. It also ordered additional recovery of Rs 6.04 crore from the Chopda factory in favour of ICICI Ltd. In the case of the Rs 81.67-crore dues, this amount was originally due from six co-operative spinning mills from the state who defaulted on their loans from IDBI, IFCI and ICICI on various occasions in the 1990s. While IFCI's loan component was settled by the state government through a payment of Rs 25 crore in December 2002, the DRT continued with its recovery proceedings against the state government. Early this week,DRT's recovery officer S. Ravindra Yadav attached two treasury accounts, besides government properties in Pune. In its latest action, the DRT has ordered recovery of dues with future interest from the factory and the state government at the rate of 20 per cent from May 3, 2002, till realisation of the full amount.

FOLLOW US ON SOCIAL MEDIA Facebook Twitter Instagram",PUNE
12,'No early polls in state',"MYSORE: KPCC president Janardhana Poojary on Friday categorically ruled out early assembly elections, and said it will be held as per schedule in September 2004. After visiting Marse village, where two communities clashed recently, Poojary said he was sure that the Lok Sabha elections would be held by this November. ""We have information that BJP top bosses have decided to go for snap polls in November, along with elections to five state assemblies, he claimed, and added that was the reason the party was gearing up to meet electoral challenges. He said the intention behind hectic tours, being taken up by himself and other party leaders, including chief minister Krishna, was to activate and galvanise the party for elections to Parliament and not the assembly. He said in an electoral democracy, everyday work of a grassroots worker or leader was intended to win elections. ""It is with this principle I am going round the state. Asked whether the Congress was scared of unity among various factions of the Janata Dal, Poojary said the people no longer trusted Dal leaders, as they quarrelled among themselves. ""Even if they get united on the eve of elections, people will not vote for them as they have realised that the JD won't do anything good for the people and its leaders are power-mongers, he said.

FOLLOW US ON SOCIAL MEDIA Facebook Twitter Instagram",MYSORE
13,"Shilpa Shetty's mother arrested, freed on bail","MUMBAI: Bollywood actress Shilpa Shetty's mother Sunanda Shetty, who is an accused in an extortion case, was Friday arrested here and promptly freed on bail. Sunanda was arrested soon after her arrival from Dubai but was granted a cash bail of Rs 40,000 at Sahar police station here as per a directive of the sessions court here. On May 28, a court in Mumbai had granted Sunanda transit bail and asked her to seek regular bail in a court in Surat, where Gujarat police registered the case against and her husband Surendra Shetty, on or before June 12. Surat police registered the case against Sunanda and Surendra for allegedly hiring a gangster to recover Rs 80 lakh payable to Shilpa for endorsing ""Praful"" brand of sarees in an ad film. Police claimed to have recorded a telephonic talk between Shilpa's parents and the complainant Pankaj Agarwal, owner of Praful sarees, in this regard. Sunanda and Surendra have denied their conversation with the gangster and alleged the tape was ""manipulated."" Earlier on Friday morning, a court in Surat rejected the anticipatory bail of Surendra Shetty in the case.

FOLLOW US ON SOCIAL MEDIA Facebook Twitter Instagram",MUMBAI
14,Sonia propels her CMs into election gear,"SRINAGAR: The Congress party has put in place quotas for students from Jammu and Kashmir and also for children of migrants from the state in professional courses in all the Congress-ruled states. Punjab, Maharashtra, Rajasthan and Madhya Pradesh have already made generous offers for professional students and states like Kerala and Himachal Pradesh have lent a helping hand in reviving the state's tourism. Congress president Sonia Gandhi made these announcements while delivering the inaugural address at the Congress Chief Ministers Conclave here on Friday. She said all sections of the J&K society should be engaged in dialogue to address the legitimate grievances of all sympathetically. The Congress has also supported the PM's Pakistan initiative stating: We have all along believed that the doors of diplomacy and the windows of dialogue with Pakistan should always be kept open and alive. Gandhi deviated from the norm of earlier such meetings and attacked the Central government on lack of employment generation: ""This is one of our principal indictments of the BJP-led NDA government"". Keeping apart time after dinner on Friday to discuss the coming assembly elections, Gandhi has clearly indicated that the party is in an election mode and will unleash its attack on the Central government over rural poverty and employment. In 1999, 2000 and in 2002 there has been an absolute decline in both public and private employment in the organized sector. The planning commission itself estimates that at current trends, unemployment rates for youth will increase to 16 per cent by the end of the Tenth Plan, she said. In a clear message against soft Hindutva, Gandhi has congratulated Rajasthan CM Ashok Gehlot for arresting VHP leader Pravin Togadia. And in what could be interpreted as a warning against the Gujarat-like experiments with Hindutva by other Congress leaders, Gandhi said, ""Let us not look to what is electorally expedient"". As a poll plank the slogan, 'Congress ka haath, garib ke saath', has been further elaborated by Gandhi seeking that her CMs implement rural poverty alleviation measures, employment generation schemes and to launch food-for-work programmes. On this count, she wanted the CMs to emulate the Maharashtra model and enact a rural employment guarantee scheme and implement it in three to four years. She has asked the CMs to provide a timetable for eliminating the backlog of SC/ST quotas in government jobs, a welfare legislation for the unorganized sector and for the democratic and autonomous functioning of cooperatives.

FOLLOW US ON SOCIAL MEDIA Facebook Twitter Instagram",SRINAGAR
15,Govt favours cut in farm loans interest rate: Rajnath,"LUCKNOW: Union agriculture minister Rajnath Singh said the Centre favoured cut in interest rate on farm loans. Any decision in this regard, however, would have to be taken only after considering all relevant factors, he said on Saturday. He said there was an urgent need to reduce the cost of agricultural inputs and ensure that the farmers get remunerative prices for their produce. Referring to the problems of cane farmers in Uttar Pradesh, Singh said he would strive hard to ensure that the cane farmers were paid their dues. Though it was a state subject, the Centre would do everything it could to resolve the problems of the cane farmers of UP, he said, adding he had also sought information from the concerned officials about the problems being faced by cane farmers in other states. Singh expressed concern at the reported move by the Uttar Pradesh government to sell off some state sector sugar mills and said efforts should be made instead to run them. He also said that India would continue to demand that developed countries reduce subsidies they gave their farmers. To a question about the alleged misuse of drought relief funds by some states, he said he would look into the matter. Singh parried questions relating to BJP president Venkaiyah Naidu's statement regarding construction of a mosque at Ayodhya and the high profile Madhumita Shukla murder case. He also said there was no threat to the Mayawati government in the wake of Rashtriya Lok Dal pulling out of the coalition, adding there was resentment in the RLD on this issue.

FOLLOW US ON SOCIAL MEDIA Facebook Twitter Instagram",LUCKNOW
16,Masood Azhar holds rally despite ban,"ISLAMABAD: Maulana Masood Azhar, leader of a militant group accused of the 2001 Indian parliament attack who was barred from addressing a party conference in Peshawar by Pakistani authorities, later addressed a gathering and hailed al-Qaeda terror network chief Osama Bin Laden and Taliban leader Mullah Omar as ""heroes of Muslim world"". Azhar, who has re-named his banned terror outfit Jaish-e-Muhammad as Kuddam-ul-Islam was barred from addressing 'Deefa-e-Islam' conference organised by his party on Friday at Press club in Peshawar, the capital of Pakistan's volatile North West Frontier Province, on the grounds that his party has been banned. He was however allowed to lay a foundation stone for a new building and permitted to address a large Friday gathering at a mosque in Peshawar, where he said Osama and Omar showed ""supreme courage and tenacity"" against US. ""We have not lost war in Afghanistan... rather it is a step towards launching greater war against the infidels. I warn all the enemies of Islam that we will not shun jehad and continue to frustrate the enemy,"" Azhar was quoted as saying by the Pakistan daily from Peshawar, The Statesman. Claiming that the present ""resistance movment"" against US forces was a testimony that Taliban has not been defeated in Afghanistan, the terrorist leader said that any Muslim country that banned jehadi organisations would perish ""because jehad was the soul of Islam."" Pakistan government imposed curbs on Azhar as the recent India-Pakistan peace process picked up steam. Few weeks ago, he was banned from addressing a meeting in Pakistan-occupied Kashmir after he lashed out at the peace moves in a separate rally there.

FOLLOW US ON SOCIAL MEDIA Facebook Twitter Instagram",ISLAMABAD
17,Pak bars Masood from addressing party meet,"ISLAMABAD: Maulana Masood Azhar, leader of a militant group accused of the 2001 Indian parliament attack who was barred from addressing a party conference in Peshawar by Pakistani authorities, later addressed a gathering and hailed Al-Qaeda chief Osama Bin Laden and Taliban leader Mullah Omar as â€œheroes of muslim worldâ€�.

Azhar, who has re-named his banned terror outfit Jaish-e-Muhammad as Kuddam-ul-Islam, was barred from addressing Deefa-e-Islam conference organised by his party on Friday at Press club in Peshawar, the capital of Pakistanâ€™s volatile North West Frontier Province, on the grounds that his party has been banned.

He was, however, allowed to lay a foundation stone for a new building and permitted to address a large Friday gathering at a mosque in Peshawar, where he said Osama and Omar showed â€œsupreme courage and tenacityâ€� against US.

â€œWe have not lost war in Afghanistan... rather it is a step towards launching greater war against the infidels. I warn all the enemies of Islam that we will not shun Jehad and continue to frustrate the enemy,â€� Azhar was quoted as saying by the Pakistan daily from Peshawar, The Statesman.

Claiming that the present â€œresistance movmentâ€� against US forces was a testimony that Taliban has not been defeated in Afghanistan, the terrorist leader said that any Muslim country that banned jehadi organisations would perish â€œbecause jehad was the soul of Islam.â€�

Pakistan government imposed curbs on Azhar as the recent Indian-Pakistan peace process picked up steam. Few weeks ago, he was banned from addressing a meeting in PoK after he lashed out at the peace moves in a seperate rally there.

Meanwhile, US Deputy Defence Secretary Paul Wolfowitz said in Singapore on Saturday that Washington is â€œvery pleasedâ€� with warming relations between India and Pakistan.

FOLLOW US ON SOCIAL MEDIA Facebook Twitter Instagram",ISLAMABAD
