,title,text,location
0,Tota's harbourer arrested,"CHANDIGARH: The crime branch of the city police on Sunday arrested another harbourer of a notorious criminal - Anil Kumar Tota and also a recovered a pistol he is alleged to have bought from Tota. Tota is wanted by Chandigarh and Mohali police in two murder and two robbery cases.

The suspected harbourer, Devinder Singh, alias Koka, a resident of Sector 18, was arrested from near the Sector 16 cricket stadium, while he was moving in his Scorpio jeep. A 9 mm pistol and 11 cartridges were also recovered from him. Koka did not have any licence for it and is learnt to have told police that he had bought this pistol for Rs 80,000 from Tota.Koka has been booked under the Arms Act and for harbouring Tota.

Koka is also an activist of a Chandigarh-based political party. Sources said that Koka had been harbouring Tota whenever he came to the city.

In fact, in October when Tota, along with three other criminals, had made a murderous attempt on the life of a Sector 40 resident and robbed him, he had stayed with Koka.

Police sources said that Koka has been maintaining contact with Tota for long and has visited him in Delhi and other hideouts. Koka is alleged to have chosen the weapon, which was recovered from him, from a range of many weapons shown to him by Tota. Koka''s role in Tota''s criminal activities is also being studied. The crime branch has already arrested three persons on the charge of harbouring Tota. Two of them were the parents of Tota''s mistress and the other a Mohali-based barber.

FOLLOW US ON SOCIAL MEDIA Facebook Twitter Instagram",CHANDIGARH
1,NGOs want atrocity laws implemented,"HYDERABAD: Revamp education system for a more holistic development of the child and strictly implement atrocity protection laws and education schemes for dalits, recommended a meeting of nongovernmental organisations.

Over 30 organisations fighting for a social cause assembled in the city on Sunday, to discuss various issues relating to women, child, dalit and human rights, as a prelude to the World Social Forum (WSF) to be held in Mumbai in January, 2004.

The day long meeting, organised by the Hyderabad Social Forum (HSF) came up with recommendations including, better projection of women in the visual media, implementation of land rights for dalits and providing vocational skills training for dalits to integrate them at competitive levels.

Suggesting to promote social responsibility, the meeting asked for public hearing of offenders.

FOLLOW US ON SOCIAL MEDIA Facebook Twitter Instagram",HYDERABAD
2,Bar Council panel to study draft rules,"BANGALORE: The Karnataka State Bar Council (KSBC) has set up a special committee to prepare objections to the draft rules pertaining to conduct of advocates in courts which has been published by the Karnataka High Court.

KSBC chairman H.C. Shivaramu told reporters here on Sunday that a special meeting decided to constitute the committee, of which he is the chairman.

The matter will be taken up with the Union government, Chief Justice of India and the Karnataka High Court Chief Justice, Shivaramu said.

Meanwhile, stating that the All India Lawyers Federation will not be recognised by the KSBC, Shivaramu said a notice has been issued to them. ""On a complaint by the Bangalore Bar Association, we will take action against Federation of Bar Associations in Karnataka, which is not a statutory body, after the matter is placed before the council,"" Shivaramu said.

FOLLOW US ON SOCIAL MEDIA Facebook Twitter Instagram",BANGALORE
3,IT's party time again for Veecees,"NEW DELHI: With product development activity on the road to revival in the country, many international venture funds are planning to set up shop in the country, close to where all the action is.

The infotech crash in 2000, coupled with an overall slow down in the sector had forced the exit of most of these funds from the country.

This time, however, it is becoming clear that product development has also received an impetus because of an increasing number NRIs from Silicon Valley making their way back to India.

Shamini Dhana, senior vice-president and director of Silicon Valley Bank, with assets of $4.5 billion, said that about 20-25 per cent of its customer base in US had their operations in India.

Boosted by this, she said, the bank is planning to start its India operation in Banglore in the next 6 to 12 months.

Besides India, the bank is also planning to set up its offices in London to look after its European operations and in Shanghai for the Chinese market.

She said that India had emerged as the most favoured destination to carry out product development activities because of the easy availability of trained manpower. India, she added, was also favoured because of its lower cost advantage.

Dhana, who was a participant at Tiecon India 2003, said that its was increasingly clear in global markets that if a company wanted to develop a product at a competitive cost, it must have an operation in India.

""It was the same for Israel in late nineties,"" she said. ""Financing institutions like bank and venture funds followed the place where product development happens in large numbers.""

Earlier, she said, after Silicon valley in US, Israel was the happening place for the product development. ""But, with NRIs from the US coming back, the stage has shifted to India.""

Ellen Levy, director of the $300-million venture fund NeoCarta Ventures, echoes a similar sentiment. She says that almost all of the companies which had financial assistance from her company had an India operation.

She said that with activities picking up over the last one year, her company was also considering its own India operation.

Sanjay Anandram, managing director, Jumpstartup Fund Advisors, said that a lot of US-based companies, which were started by Indians, have also shifted their base to India.

This was significant, he says, adding that with most of these companies already being funded by VCs, the VCs are also shifting their area of operation to India.

Clearly, says Dhana, services activities like call centres, MTs and business process outsourcing firms (BPOs) are no more the area of interests for VCs. The focus is shifting, se says, to the creation of intellectual property.

President of Tie New Delhi and trustee of global board, Saurabh Srivastava said that venture fund activities are on the rise. He said that in 2003, funds worth around $900 million were disbursed.

With NRIs returning, IT product development activities were once gain gaining momentum and this, he said, had increased venture fund requirements. This would increase VC activity in India next year, he said.

FOLLOW US ON SOCIAL MEDIA Facebook Twitter Instagram",NEW DELHI
4,Six arrested in crackdown on illicit fuel racket,"PUNE: Acting on a tip-off, the district supply officers, state vigilance officers and the rural police on Sunday busted an illicit fuel supply racket at Kunjirwadi in Loni-Kalbhor. Nine tankers, 22 barrels and one motorcycle were seized in the operation. While six persons were arrested, three managed to escape.

The Loni-Kalbhor police said the barrels contained blue kerosene, nafta and other chemicals and the drivers were mixing them at an isolated place in Kunjirwadi.

The solvent obtained after mixing the chemicals was being used as fuel, the officials said. Of the nine tankers seized, eight contained the solvent, the police said, adding that the material seized was worth around Rs 82 lakh.

The operation was supervised by senior police officials from the rural police, Haveli tehsildar Sampatrao Davkar and district supply officer Sambhaji Chavan. The operation, which started at 3 am, ended around 5 pm on Sunday.

The six arrested have been identified as Ramesh Soraj (35), Ramashankar Mishra (43), Ramesh Pande (46), Gajahit Yadav (24), Lalji Chavan (26) and Rameshkumar Harjan (18), all residents of Ghatkopar in Mumbai.

The police have not ruled out the possibility of a bigger racket. Descriptions of those who managed to escape have been sent to other police stations.

One of the main suspects, identified as Shailendra Singh, is among those who managed to escape, the police added.

The police suspect that the mixing was going on for some time. The accused used to get the contents from Mumbai, mix them in a remote area and then sell it.

The police said the tankers are owned by K.K Singh and AvdeshKumar Singh, both residents of Mulund in Mumbai. The role of the tanker owners is being probed, along with the places and people to whom the fuel was being sold.

FOLLOW US ON SOCIAL MEDIA Facebook Twitter Instagram",PUNE
5,LIC net seller since start of current boom,"MUMBAI: Life Insurance Corporation of India (LIC) has been a net seller on the bourses since the start of the current rally. This is a major departure for the country''s largest insurer, which has been a net buyer over the last few years.

""In the current fiscal, while LIC has bought shares of around Rs 3,000 crore, it sold shares worth Rs 5,100 crore. This amounts to net sales of around Rs 2,100 crore during the year,"" said LIC managing director RN Bhardwaj.

""We have traditionally been contrarions. While foreign institutional investors bought, we chose to sell,"" he added. Similarly, the insurance major had been on a buying spree over the last three years when the equity markets were on a downward spiral.

A senior LIC official said its contrarion approach to the market has lent a certain amount of stability to the Indian bourses. If LIC chose to follow the lead of FIIs — buying when they bought and selling when they sold — the equity markets would have seen significant volatility, he added.

LIC''s total equity portfolio, when valued at cost of acquisition, is currently at around Rs 24,000 crore. However, if this is on a marked-to-market basis, the total equity portfolio will be worth around Rs 41,000 crore.

""Since our investments were made over a reasonably long period of time, our average cost of acquisition is not very high,"" said Bhardwaj. At present, LIC holds close to 10 per cent of the equity capital of a host of Sensex stocks, which result in a substantial dividend income.

Over the last one year, LIC has also increased its trading portfolio by almost three times, close to Rs 1,500 crore from around Rs 500 crore, added Bhardwaj.

However, it has not set any target level for its trading portfolio. The size of the insurance company''s trading portfolio would depend on market conditions.

This allows policy-holder to make premium payments through Corporation Bank''s automated teller machines (ATMs).

FOLLOW US ON SOCIAL MEDIA Facebook Twitter Instagram",MUMBAI
