,title,text,location
0,Civil aviation policy soon,"NEW DELHI: The aviation industry can finally breathe easy. Ending weeks of suspense over the fate of reforms in the sector, newly appointed civil aviation minister Praful Patel said the government will soon announce a comprehensive civil aviation policy.

Strengthening of the two state-owned carriers — Indian Airlines and Air-India — is also high on his list of things-to-do, Patel told TNN. ""We want to restore their lost glory.""

This could be a positive signal that the two carriers will finally be allowed to go ahead with their aircraft acquisition programme.

On the issue of permitting private domestic airlines to fly abroad, he said, ""Our intention is to expand the overall civil aviation sector. But this does not mean that we will be curbing the private carriers in any way.""

The new government, he said, has not closed its doors to privatisation of Delhi and Mumbai airports.

FOLLOW US ON SOCIAL MEDIA Facebook Twitter Instagram",NEW DELHI
1,TKA Nair new principal secy to Manmohan,"NEW DELHI: TKA Nair, a 1967 batch IAS officer of the Punjab cadre, was on Sunday appointed principal secretary to Prime Minister Manmohan Singh.

He attended the first meeting of the Manmohan Singh cabinet on Sunday. The first bureaucratic appointment after the regime change, it will be Nair''s second entry into the PMO. He was part of I K Gujral''s PMO in 1997-98. Nair, a former chief secretary of Punjab, was currently chairman of the Public Enterprises Selection Board.

He has been on several committees together with Singh. ""The two have known each other for a long time and have a good equation,"" a source said.

FOLLOW US ON SOCIAL MEDIA Facebook Twitter Instagram",NEW DELHI
2,5 Bihar ministers quit to join Cabinet,"PATNA: Five ministers in the Rabri Devi government, including Mohd Taslimuddin, Shakeel Ahmed and Akhilesh Prasad Singh, who have been inducted into the Union Council of Ministers.

Bihar Governor M Rama Jois has accepted the resignation of all the five ministers on the recommendation of Chief Minister Rabri Devi, Raj Bhawan sources said on Sunday.

The ministers who have resigned are Mohammed Taslimuddin (Building Construction), Sita Ram Yadav (Information and Public Relation department), Sita Ram Singh (Mines), Dr Shakeel Ahmed (Medical Education) and Akhilesh Prasad Singh (Minister of State for Health).

Among the five, Ahmed is from Congress and the rest belong to RJD.

FOLLOW US ON SOCIAL MEDIA Facebook Twitter Instagram",PATNA
3,BJP flays induction of tainted ministers,"PATNA: Criticising Prime Minister Manmohan Singh for appointing four ''tainted'' RJD ministers in his team, including the multi-crore fodder scam accused, Laloo Prasad Yadav, the BJP in Bihar on Sunday said that it would launch an agitation across the state to make people aware of the ''dark'' background of the ministers.

Party workers would hold sit-in demonstrations and protest-marches in every district to protest against the inclusion of Laloo Yadav and three of his party colleagues, chargesheeted in separate criminal cases, in the Union cabinet, state party president Gopal Narayan Singh said.

While RJD president Laloo Yadav is chargesheeted by CBI in the fodder scam, Md Taslimuddin is an accused in over a dozen criminal cases, including alleged rape of a minor.

Taslimuddin was removed within a week as minister of state for Home from the United Front government headed by H D Devegowda for his criminal background.

Among two others, Jay Prakash Narayan Yadav had to resign as education minister in the Rabri Devi cabinet in 2002 following his implication in the scam involving awarding of fake B.Ed degrees by some colleges of the Lalit Narayan Mithila university. He was jailed in the case.

The MP from Darbhanga, M A Fatimi, was accused of giving shelter to an aide of underworld don, Dawood Ibrahim.

Singh said that his party would make people aware of the ''dark'' background of Laloo Yadav and others and expose the Congress claim of giving a ''clean'' ministry.

FOLLOW US ON SOCIAL MEDIA Facebook Twitter Instagram",PATNA
4,"Karunanidhi miffed, DMK ministers bunk office","CHENNAI: Unhappy over the portfolios allotted to its ministers, the DMK on Sunday night decided not to assume office till ""the mistakes are rectified,"" party President M Karunanidhi said here.In a statement issued beyond midnight, he said, ""some days ago, certain portfolios were promised for DMK MPs and a letter to this effect was given to the party by Congress leader Janardhan Reddy.""""But the portfolios announced tonight went contrary to the assurances given in the letter,"" he said, adding, ""DMK has therefore decided that its ministers will not assume office till these mistakes are corrected"".DMK has seven ministers in the Congress-led coalition government with three of them -- T R Baalu, Dayanidhi Maran and A Raja -- holding the Cabinet rank.",CHENNAI
5,Defence deals by NDA govt could be probed: Mukherjee,"NEW DELHI: Affirming that the new government would strive for total transparency in armament purchases, Defence Minister Pranab Mukherjee on Monday said some of the defence deals entered into by the NDA regime could be looked into.

""If specific charges come up regarding defence deals concluded by the BJP-led government, these would be looked into,"" Mukherjee told newsmen as he assumed office.

The new government, he said, was committed to bring in total transparency in defence purchases.

Mukherjee said the new government wanted to ensure that institutional arrangement for arms procurement was made transparent and these cover both emergency and well as regular purchases.

Spelling out the priorities of the new government on security issues, he said the ongoing modernisation and upgradation of weaponry and training of the armed forces would be carried out with redoubled vigour and emphasis would be to ensure that all allocated funds for strategic systems were utilised and not allowed to lapse as was happening earlier.

""The budget resources of the country are scarce and efforts have to be made that they are optimally spent. Whatever is required for security of the nation would be made available,"" he said.

FOLLOW US ON SOCIAL MEDIA Facebook Twitter Instagram",NEW DELHI
6,Paswan against disinvestment of steel PSUs,"NEW DELHI: Taking a tough stand against the disinvestment of profit-making PSUs, new Steel Minister Ram Vilas Paswan on Monday said the two steel sector companies in the disinvestment list should not be sold to private players.

""Both the PSUs, Manganese Ore India Ltd and Sponge Iron India Ltd, are profit-making and I shall talk to the government that these need not be divested,"" he told reporters immediately after taking charge of his ministry.

Regarding the three loss-making steel PSUs in the disinvestment list of the previous government, Paswan said these companies would also be reviewed to make them profitable and their about 7000 employees'' needs would be taken care of.

The three loss-making entities are Salem Steel Plant, Alloy Steel Plant and Vishweshwaraiya Steel plant, whose combined annual loss stood at Rs 400 crore, he said.

Paswan said he needed a fortnight to be conversant with the details of his ministry, adding ""I shall personally visit these three units and see if they can be turned around.""

FOLLOW US ON SOCIAL MEDIA Facebook Twitter Instagram",NEW DELHI
7,Ahmedabad gangrape case: Delhi Doc arrested,"AHMEDABAD: Gujarat police have arrested a doctor from New Delhi in connection with the alleged gangrape of a city girl on New year Eve, police said.

The doctor has been arrested for harbouring the prime accused Sajal Jain when he was admitted at a hospital in New Delhi after the incident, Assistant Commissioner of Police (ACP) K K Oza said here on Monday.

Jain, a Delhi-based businessman and several others have already been arrested in this case.

FOLLOW US ON SOCIAL MEDIA Facebook Twitter Instagram",AHMEDABAD
8,Kalyan hints at strenthening party base in Delhi,"LUCKNOW: After party''s debacle in Uttar Pradesh under him, the former chief minister and senior BJP leader Kalyan Singh hinted to play political innings in Delhi. He gave this indication after quitting UP Assembly seat from Atrauli to retain Bulandshahr parliamentary constituency from where he was elected to the Lok Sabha for the first time.

He submitted his resignation to the acting speaker UP Assembly Waqar Ahmed Shah on Monday afternoon. ""His resignation has been accepted,"" stated the acting speaker.

Talking to mediapersons after quitting UP Assembly membersip, Kalyan said that he has been asked by the BJP central leadership to come to Delhi and help the party strengthen its organisation and support base. Although Kalyan claimed that he would follow directions of the party high command but he was yet to finally make up his mind to join the party organisation in Delhi.

If he decides to go to Delhi, it would be first time in Kalyan''s political career that the senior BJP leader would be playing political innings outside Uttar Pradesh. He was once given this offer way back in 1996 when he he had vehemently opposed an alliance with the BSP again to form a coalition government after hung Assembly.

But this did not mean that Kalyan would leave Uttar Pradesh from where he began his political career way back in early 60s. ""I would not leave Uttar Pradesh and continue to serve the party and people if I went to Delhi,"" he asserted.

Kalyan had won the Atrauli Assembly seat in Aligarh a record number of ten times. He had lost the seat only twice in 1962 and 1980 when a pro-Congress wave was blowing in favour of Indira Gandhi after failure of the Janata Party regime.

Taking a fresh dig at Sonia Gandhi''s foreign origin, Kalyan said that comparing Sonia with Mahatma Gandhi was a ''cruel joke''. Demanding a CBI probe into her foreign origin, Kalyan said that her so-called sacrifice was nothing but a garb to run the UPA government by proxy. ""Congressmen have shown great disrespect to Father of the Nation by comparing Sonia with Mahatma Gandhi,"" he quipped.

On party debacle, Kalyan said that he was personally review results in all Lok Sabha constituencies to ascertain reasons for party dismal performance. ""I would be visiting all Lok Sabha constituencies to review results. Corrective measures would be taken after the exercise is over,"" he said, refusing to make any comment on the possible changes in the state unit in view of debacle.



FOLLOW US ON SOCIAL MEDIA Facebook Twitter Instagram",LUCKNOW
9,'Criminal' ministers RJD's choice: Cong,"NEW DELHI: Congress on Monday sought to distance itself from the induction of chargesheeted persons, including RJD chief Laloo Prasad Yadav, in the Union Cabinet, saying these decisions were taken by concerned allies.

""It was decided by the respective leaders of allies,"" party spokesman Anand Sharma told reporters when asked why chargesheeted persons like Yadav and his party colleague Taslimuddin and JMM chief Sibu Soren had been inducted into the ministry in spite of the fact that the Congress had been opposing presence of chargesheeted ministers in the previous NDA Government.

""It is a coalition Government and they are our pre-poll allies. Decisions are taken by the respective leaders jointly. They were given mandate by the people,"" he said.

""I cannot go beyond it,"" he said when further pressed on the issue.

Defending Taslimuddin''s and his induction into the Cabinet, Yadav, who took over as the Railway Minister, told reporters that mere chargsheeting of a person did not mean that he or she had been convicted and cited the example of Tamil Nadu Chief Minister Jayalalithaa and BJP leaders L K Advani and Murli Manohar Joshi.

Taslimuddin said some cases related to agitation were pending against him which had nothing to do with his becoming a Minister.

Commenting on the formation of the UPA Government, BJP said some persons who had been chargesheeted or had criminal cases pending against them had been inducted into the Union Cabinet.

Party spokesman Mukhtar Abbas Naqvi said ""some of the Ministers in the Union Cabinet are facing charges in various cases.""

He was also critical of induction of Shivraj Patil and P M Sayeed, who had lost the recent Lok Sabha polls, in the Cabinet.

FOLLOW US ON SOCIAL MEDIA Facebook Twitter Instagram",NEW DELHI
