,title,text,location
14,BJP for simultaneous polls,"KOLKATA: BJP on Monday appealed to the chief ministers of Maharashtra, Karnataka and Bihar to call simultaneous Assembly elections in their states along with the forthcoming Lok Sabha polls, saying it would save a lot of public money.

""I appeal to the Chief Ministers of Maharashtra and Karnataka, where assembly elections are scheduled in September and also to the Chief Minister of Bihar, where the polls are to be held in February next year, to hold them along with Lok Sabha elections. This will save a lot of government money,"" BJP General Secretary Pramod Mahajan told a press conference here.

Pointing out that the Chief Ministers of Andhra Pradesh and Sikkim had already announced dissolution of their state assemblies and the Orissa Chief Minister had hinted of doing so, Mahajan said that they had taken the right decision.

""This is because there is no point having the Lok Sabha elections in April and again having the Assembly polls in another six to eight months'' time,"" he said.

Turning to the Lok Sabha poll dates, Mahajan said that it was the prerogative of the Election Commission to decide it, but ""it is the duty of the Election Commission to see that the new Lok Sabha is constituted at the earliest.

""We hope at the end of March elections will start and may conclude by the end of April,"" he said adding that it was upto the Election Commission to decide upon the dates after taking into consideration the security aspects, availability of polling stations and personnel.

FOLLOW US ON SOCIAL MEDIA Facebook Twitter Instagram",KOLKATA
15,'WB would witness miracle in LS polls',"KOLKATA: The BJP and Trinamool Congress on Monday claimed that West Bengal would witness a ''miracle'' with the two NDA partners doubling their seats in the coming Lok Sabha polls and urged the Election Commission to make ''special arrangements'' to ensure free and fair polls in the Marxist-ruled state.

""Ground realities are that a great miracle is going to happen. Together we hope to win little more than the double the seats we won in the last elections,"" the BJP General Secretary Pramod Mahajan told reporters at a joint press conference along with TC chief Mamata Banerjee.

The TC and BJP combine had bagged eleven seats (9 by TC and 2 by BJP) in the last Lok Sabha polls.

Mahajan, who held a nearly one-and-half hour long meeting with Banerjee at the TC headquarters also said, ""at the national level we will fight the elections under the leadership of Prime Minister Vajpayee and at the state level under Mamata Banerjee''s leadership.

The senior BJP leader who discussed joint election strategy and campaigning including a joint rally of BJP and TC workers to be addressed by Vajpayee in the last week of February with Banerjee, said ""we are interested in defeating the Communist regime in West Bengal"".

Alleging that popular sentiments were not reflected in the West Bengal elections results due to ''large-scale rigging'' by the Left Front government, Mahajan said that a joint delegation of BJP and TC leaders would meet the full Election Commission after dissolution of the Lok Sabha to request for making special arrangements to ensure free and fair Lok Sabha polls in the state.

FOLLOW US ON SOCIAL MEDIA Facebook Twitter Instagram",KOLKATA
